{
  "schema_version": "1.0",
  "study_id": "S04",
  "run_id": "S04-36e06a94-2716e1bf",
  "code_version": "36e06a9402b561bcf051e186c11ae9aeabf8aa42",
  "source_sha256": {
    "research_program/__init__.py": "5abb4829b477fd3068ee4c11dad2b59cd33e90aad06a17a5e9fb2f840a75abf1",
    "research_program/evaluation.py": "09a5d060c34b8cd1e5a3330d90f5ff3e12adbca8cfe1ebe3297da2b91d227e45",
    "research_program/io.py": "16de123c16d80bce5eb8d6766224dec1729d7c00449c2528f2348d86ad68d35f",
    "research_program/validate.py": "3e6a591e2b77799bdf73683db438b2998e2e457340626c98b7ceed510ab3329e",
    "studies/S04/config.json": "6fd142c850fa1c1b3b60b83640f52371c1b4f7be7bb6c8802cdd3bec043d9e4a",
    "studies/S04/effects.py": "69283d7daf8ffd89145615448acffe0a180d7edb3f37ed92901f5ed0034fca7c",
    "studies/S04/ingest.py": "a7e0c9ec87561df73dbe4133696f6bc0709ef67b2032326c745185109e9c666f",
    "studies/S04/study.py": "3fea8664792268e3953d34aba6e469f34e2986f003a8afecbea87edd7381a281",
    "uv.lock": "15f381c7c88897e1df049af6297905625b6869a6c9ff110ab1647ec2d0f305f4"
  },
  "evaluated_on": "2026-09-29",
  "data": {
    "source_url": "https://ailab.criteo.com/criteo-uplift-prediction-dataset/",
    "release": "Corrected Criteo v2.1; downloaded 2026-09-29",
    "sha256": "2716e1bf0fd157a93b5bf86924d9088419dfbac2022c6cd90030220634f616dc",
    "license": "CC BY-NC-SA 4.0; https://creativecommons.org/licenses/by-nc-sa/4.0/; aggregate research transformations; no warranty.",
    "citation": "Diemert, Betlei, Renaudin & Amini (2018), A Large Scale Benchmark for Uplift Modeling, AdKDD/TargetAd Workshop.",
    "coverage": "13,979,592 source records; anonymous benchmark with no released dates or campaign IDs."
  },
  "target": {
    "label": "Recorded conversion under assigned advertising eligibility",
    "estimand": "Released-benchmark policy treatment contrast conditional on sampling and exchangeability assumptions",
    "prediction_cutoff": "Anonymized baseline features only; realized exposure and both outcomes excluded",
    "horizon": "Publisher conversion label; exact attribution window and per-record dates unavailable",
    "unit": "Released anonymous record, clustered by matching feature profile"
  },
  "cohort": "Outcome-independent profile-hash sample; disjoint development/validation/evaluation profiles; bounded fitting subset.",
  "samples": {
    "total": 1995142,
    "train": 596910,
    "validation": 399506,
    "test": 398506,
    "test_profiles": 352598,
    "events": {
      "train": 1777,
      "validation": 1132,
      "test": 1243
    }
  },
  "models": [
    {
      "id": "dr_l2_10",
      "label": "Doubly robust learner · L2 10",
      "specification": {
        "family": "cross-fitted doubly robust learner",
        "l2": 10,
        "leaves": 7,
        "iterations": 120
      }
    },
    {
      "id": "dr_l2_100",
      "label": "Doubly robust learner · L2 100",
      "specification": {
        "family": "cross-fitted doubly robust learner",
        "l2": 100,
        "leaves": 7,
        "iterations": 120
      }
    },
    {
      "id": "honest_forest_100",
      "label": "Honest causal forest · leaf 100",
      "specification": {
        "family": "EconML honest causal forest DML",
        "min_leaf": 100,
        "trees": 128,
        "depth": 10,
        "max_samples": 0.45,
        "honest": true,
        "inference": "independent profile-cluster policy intervals"
      }
    },
    {
      "id": "honest_forest_500",
      "label": "Honest causal forest · leaf 500",
      "specification": {
        "family": "EconML honest causal forest DML",
        "min_leaf": 500,
        "trees": 128,
        "depth": 10,
        "max_samples": 0.45,
        "honest": true,
        "inference": "independent profile-cluster policy intervals"
      }
    },
    {
      "id": "response",
      "label": "Response-probability targeting",
      "specification": {
        "family": "development-fitted treated conditional mean"
      }
    },
    {
      "id": "random",
      "label": "Expected random allocation",
      "specification": {
        "family": "expected random allocation"
      }
    }
  ],
  "metrics": [
    {
      "name": "incremental_benchmark_conversions_per_10000",
      "model": "dr_l2_10",
      "unit": "incremental benchmark conversions per 10000 eligible records",
      "split": "untouched profile-separated final cohort",
      "estimate": 9.5433928,
      "lower": 5.87596261,
      "upper": 13.21082299,
      "confidence": 0.95,
      "standard_error": 1.87117224,
      "clusters": 352598
    },
    {
      "name": "incremental_benchmark_conversions_per_10000",
      "model": "dr_l2_100",
      "unit": "incremental benchmark conversions per 10000 eligible records",
      "split": "untouched profile-separated final cohort",
      "estimate": 9.66355226,
      "lower": 6.02288456,
      "upper": 13.30421996,
      "confidence": 0.95,
      "standard_error": 1.85751765,
      "clusters": 352598
    },
    {
      "name": "incremental_benchmark_conversions_per_10000",
      "model": "honest_forest_100",
      "unit": "incremental benchmark conversions per 10000 eligible records",
      "split": "untouched profile-separated final cohort",
      "estimate": 9.49525489,
      "lower": 5.69709872,
      "upper": 13.29341106,
      "confidence": 0.95,
      "standard_error": 1.93787039,
      "clusters": 352598
    },
    {
      "name": "incremental_benchmark_conversions_per_10000",
      "model": "honest_forest_500",
      "unit": "incremental benchmark conversions per 10000 eligible records",
      "split": "untouched profile-separated final cohort",
      "estimate": 9.77926724,
      "lower": 5.96002988,
      "upper": 13.59850459,
      "confidence": 0.95,
      "standard_error": 1.94862629,
      "clusters": 352598
    },
    {
      "name": "incremental_benchmark_conversions_per_10000",
      "model": "response",
      "unit": "incremental benchmark conversions per 10000 eligible records",
      "split": "untouched profile-separated final cohort",
      "estimate": 9.86157129,
      "lower": 6.05611669,
      "upper": 13.66702589,
      "confidence": 0.95,
      "standard_error": 1.94159415,
      "clusters": 352598
    },
    {
      "name": "incremental_benchmark_conversions_per_10000",
      "model": "random",
      "unit": "incremental benchmark conversions per 10000 eligible records",
      "split": "untouched profile-separated final cohort",
      "estimate": 2.04057666,
      "lower": 1.24385683,
      "upper": 2.83729648,
      "confidence": 0.95,
      "standard_error": 0.40649718,
      "clusters": 352598
    }
  ],
  "uncertainty": "Paired 95% profile-cluster normal intervals from independent held-out score contributions. Conditional on fitted models and rankings; unobserved campaign dependence and privacy-selection bias are not identified.",
  "assumptions": [
    "Consistency, overlap and benchmark-sample exchangeability are needed for causal interpretation.",
    "Non-uniform privacy subsampling prevents recovery of original advertiser effects or economics.",
    "Matching profiles are grouped conservatively; they are not asserted to identify people.",
    "Assumed conversion value and contact cost are scenario inputs only."
  ],
  "limitations": [
    "No dates, campaign IDs, demographic meanings or original experimental strata are released.",
    "Rare conversion and control events can make capacity-specific contrasts imprecise.",
    "Cluster intervals omit fitting uncertainty and are not simultaneous frontier guarantees.",
    "Profile-hash sampling and bounded fitting do not establish full-source or current-market performance.",
    "Exposure and visit are excluded as post-assignment variables.",
    "No advertiser ROI, realized profit or fairness conclusion is identified.",
    "Independent technical review is pending."
  ],
  "tables": {
    "audit": {
      "source_rows": 13979592,
      "source_label_counts": {
        "treatment": 11882655,
        "conversion": 40774,
        "visit": 656929,
        "exposure": 428212
      },
      "missing": {
        "f0": 0,
        "f1": 0,
        "f2": 0,
        "f3": 0,
        "f4": 0,
        "f5": 0,
        "f6": 0,
        "f7": 0,
        "f8": 0,
        "f9": 0,
        "f10": 0,
        "f11": 0,
        "treatment": 0,
        "conversion": 0,
        "visit": 0,
        "exposure": 0
      },
      "bounded_rows": 1995142,
      "bounded_unique_profiles": 1763767,
      "repeated_profile_rows": 231375,
      "partitions": {
        "development": {
          "rows": 596910,
          "profiles": 527686,
          "cells": [
            {
              "treatment": 0,
              "conversion": 0,
              "n": 89440
            },
            {
              "treatment": 0,
              "conversion": 1,
              "n": 170
            },
            {
              "treatment": 1,
              "conversion": 0,
              "n": 505693
            },
            {
              "treatment": 1,
              "conversion": 1,
              "n": 1607
            }
          ],
          "exposure_cells": [
            {
              "treatment": 0,
              "exposure": 0,
              "n": 89610
            },
            {
              "treatment": 1,
              "exposure": 0,
              "n": 489082
            },
            {
              "treatment": 1,
              "exposure": 1,
              "n": 18218
            }
          ]
        },
        "validation": {
          "rows": 399506,
          "profiles": 353275,
          "cells": [
            {
              "treatment": 0,
              "conversion": 0,
              "n": 59695
            },
            {
              "treatment": 0,
              "conversion": 1,
              "n": 113
            },
            {
              "treatment": 1,
              "conversion": 0,
              "n": 338679
            },
            {